{
  "snapshot_id": "snapshot-pcram-bulletin-2026-05-20t120000z",
  "source_id": "pcram-bulletin",
  "source_name": "PCRAM Bulletin (Sample)",
  "source_type": "pcram_bulletin",
  "source_url": "https://example.local/pcram/bulletin",
  "captured_at": "2026-05-20T12:00:00.000Z",
  "captured_by": "local-fixture-generator",
  "capture_method": "simulated_fixture",
  "content_hash": "aaaaaaaaaaaaaaaaaaaaaaaaaaaaaaaaaaaaaaaaaaaaaaaaaaaaaaaaaaaaaaaa",
  "raw_text_path": "snapshots/pcram/raw/example-bulletin-2026-05-20.txt",
  "normalized_payload": {
    "title": "Sample PCRAM Bulletin",
    "sections": [
      {
        "section_id": "s1",
        "heading": "General Updates",
        "body": "This is a harmless local sample used for P0 planning validation."
      }
    ],
    "ncm_mentions": ["0101.21.00"]
  },
  "notes": [
    "Local-only sample fixture.",
    "No external fetch was executed.",
    "For schema validation and documentation only."
  ]
}
